{
  "id": "0192cae6-0007-7000-8000-000000000000",
  "eval_run_id": "0192cae6-0004-7000-8000-000000000000",
  "session_trace_id": "0192cae6-0005-7000-8000-000000000000",
  "matcher_map_id": "0192cae6-0003-7000-8000-000000000000",
  "judge_identity": "audit-harness@0.3.0:escape-scan",
  "judge_version": "0.3.0",
  "verdict": "PASS",
  "verdict_source": "deterministic",
  "confidence": null,
  "reasoning": null,
  "input_hash": "3939393939393939393939393939393939393939393939393939393939393939",
  "seed": null,
  "evaluated_at": "2026-05-17T00:00:05Z",
  "latency_ms": 12,
  "cost_record_ref": "0192cae6-0009-7000-8000-000000000000"
}
